{
  "$schema": "https://json-schema.org/draft/2020-12/schema",
  "$id": "urn:aibridge:contracts:v1:artifact",
  "title": "Artifact",
  "description": "@generated by scripts/generate-contracts.ts from src/orchestration/schemas.ts:773 (export artifactSchema). DO NOT EDIT. Invariants from .refine()/.superRefine() are NOT representable in JSON Schema and are absent from this file; they remain enforced by the TypeScript engine, which is the sole authority for them (ADR 0008 §2.2 Tier 2).",
  "type": "object",
  "properties": {
    "schemaVersion": {
      "anyOf": [
        {
          "type": "number",
          "const": 1,
          "title": "ArtifactSchemaVersion0"
        },
        {
          "type": "number",
          "const": 2,
          "title": "ArtifactSchemaVersion1"
        }
      ]
    },
    "artifactId": {
      "type": "string",
      "pattern": "^[A-Za-z0-9][A-Za-z0-9._:-]{0,127}$",
      "title": "ArtifactArtifactId"
    },
    "projectId": {
      "type": "string",
      "pattern": "^[A-Za-z0-9][A-Za-z0-9._:-]{0,127}$",
      "title": "ArtifactProjectId"
    },
    "runId": {
      "type": "string",
      "pattern": "^[A-Za-z0-9][A-Za-z0-9._:-]{0,127}$",
      "title": "ArtifactRunId"
    },
    "dispatchId": {
      "type": "string",
      "pattern": "^[A-Za-z0-9][A-Za-z0-9._:-]{0,127}$",
      "title": "ArtifactDispatchId"
    },
    "sessionId": {
      "type": "string",
      "pattern": "^[A-Za-z0-9][A-Za-z0-9._:-]{0,127}$",
      "title": "ArtifactSessionId"
    },
    "name": {
      "type": "string",
      "minLength": 1,
      "maxLength": 256,
      "title": "ArtifactName"
    },
    "mediaType": {
      "type": "string",
      "maxLength": 256,
      "pattern": "^[A-Za-z0-9!#$&^_.+-]+\\/[A-Za-z0-9!#$&^_.+-]+$",
      "title": "ArtifactMediaType"
    },
    "digest": {
      "type": "string",
      "pattern": "^sha256:[0-9a-f]{64}$",
      "title": "ArtifactDigest"
    },
    "byteCount": {
      "type": "integer",
      "minimum": -9007199254740991,
      "maximum": 9007199254740991,
      "title": "ArtifactByteCount"
    },
    "source": {
      "oneOf": [
        {
          "type": "object",
          "properties": {
            "kind": {
              "type": "string",
              "const": "session",
              "title": "ArtifactSource0Kind"
            },
            "sessionId": {
              "type": "string",
              "pattern": "^[A-Za-z0-9][A-Za-z0-9._:-]{0,127}$",
              "title": "ArtifactSource0SessionId"
            }
          },
          "required": [
            "kind",
            "sessionId"
          ],
          "additionalProperties": false,
          "title": "ArtifactSource0"
        },
        {
          "type": "object",
          "properties": {
            "kind": {
              "type": "string",
              "const": "external",
              "title": "ArtifactSource1Kind"
            },
            "reference": {
              "type": "object",
              "properties": {
                "namespace": {
                  "type": "string",
                  "minLength": 1,
                  "maxLength": 256,
                  "title": "ArtifactSource1ReferenceNamespace"
                },
                "id": {
                  "type": "string",
                  "minLength": 1,
                  "maxLength": 4096,
                  "title": "ArtifactSource1ReferenceId"
                }
              },
              "required": [
                "namespace",
                "id"
              ],
              "additionalProperties": false
            }
          },
          "required": [
            "kind",
            "reference"
          ],
          "additionalProperties": false,
          "title": "ArtifactSource1"
        }
      ]
    },
    "location": {
      "oneOf": [
        {
          "type": "object",
          "properties": {
            "kind": {
              "type": "string",
              "const": "locator",
              "title": "ArtifactLocation0Kind"
            },
            "locator": {
              "type": "string",
              "minLength": 1,
              "maxLength": 4096,
              "title": "ArtifactLocation0Locator"
            }
          },
          "required": [
            "kind",
            "locator"
          ],
          "additionalProperties": false,
          "title": "ArtifactLocation0"
        },
        {
          "type": "object",
          "properties": {
            "kind": {
              "type": "string",
              "const": "external_reference",
              "title": "ArtifactLocation1Kind"
            },
            "reference": {
              "type": "object",
              "properties": {
                "namespace": {
                  "type": "string",
                  "minLength": 1,
                  "maxLength": 256,
                  "title": "ArtifactLocation1ReferenceNamespace"
                },
                "id": {
                  "type": "string",
                  "minLength": 1,
                  "maxLength": 4096,
                  "title": "ArtifactLocation1ReferenceId"
                }
              },
              "required": [
                "namespace",
                "id"
              ],
              "additionalProperties": false
            }
          },
          "required": [
            "kind",
            "reference"
          ],
          "additionalProperties": false,
          "title": "ArtifactLocation1"
        }
      ]
    }
  },
  "required": [
    "schemaVersion",
    "artifactId",
    "projectId",
    "runId",
    "dispatchId",
    "name",
    "mediaType",
    "digest",
    "byteCount",
    "source",
    "location"
  ],
  "additionalProperties": false
}
